### ISSUE TITLE
Empty SNMP report from Agent

### ISSUE THREAD

**Issue by groulot** [OCSInventory-NG/UnixAgent#307]
### General informations
Operating system :  Ubuntu 18.04
Perl version : 5.26.1

### OCS Inventory informations
Unix agent version : 2.8 (master branch at ee0645b504a26c5d54e7affad0c945b535afcab4 )

### Problem's description

The OCS agent doesn't scans the OID present in the Type Configuration, it scans the "Type" OID as many times as there are Type confs. It also doesn't send anything in its report, while there are SNMP equipments on the scanned network.

In OCS:
- I configured SNMP community.
- Created a type "sysName" (poor naming) with OID 1.3.6.1.2.1.1.5.0 (sysName).
- Created several labels: Name, Description, etc.
- Used "Add MIB file" to connect them to RFC1213-MIB.
- The Type Configuration is thus:

| Type | Label | OID | Reconcilation |
| ----- | ------ | ---- | --------------- |
| sysName | Description | 1.3.6.1.2.1.1.1 |   |  
| sysName | Name | 1.3.6.1.2.1.1.5 |   |  
| sysName | Location | 1.3.6.1.2.1.1.6 |   |  
| sysName | IP | 1.3.6.1.2.1.4.20.1.1 |   |  
| sysName | Netmask | 1.3.6.1.2.1.4.20.1.3 |   |  
| sysName | Contact | 1.3.6.1.2.1.1.4

The agent is configured like this:

modules.conf:
```
use Ocsinventory::Agent::Modules::Download;
use Ocsinventory::Agent::Modules::SnmpScan;

# DO NOT REMOVE the 1;
1;
```
ocsinventory-agent.cfg:
```
server=https://xxxxxxxxx.net/ocsinventory
tag=1
ca=/etc/ocsinventory/cacert.pem
ssl=1
```

The agent is started like this: ` ./ocsinventory-agent --devlib --debug --nosoftware`

tcpdump of the traffic to one of my SNMP equipments, only one OID is requested repeatedly:
```
11:27:20.720789 ARP, Reply 10.0.3.11 is-at 00:50:56:96:cb:af, length 46
11:30:28.076195 IP 10.0.3.47.33748 > 10.0.3.11.161:  C="X" GetRequest(28)  .1.3.6.1.2.1.1.5.0
11:30:28.076643 IP 10.0.3.11.161 > 10.0.3.47.33748:  C="X" GetResponse(40)  .1.3.6.1.2.1.1.5.0="My-Server"
11:30:28.077660 IP 10.0.3.47.33748 > 10.0.3.11.161:  C="X" GetRequest(28)  .1.3.6.1.2.1.1.5.0
11:30:28.077840 IP 10.0.3.11.161 > 10.0.3.47.33748:  C="X" GetResponse(40)  .1.3.6.1.2.1.1.5.0="My-Server"
11:30:28.078437 IP 10.0.3.47.33748 > 10.0.3.11.161:  C="X" GetRequest(28)  .1.3.6.1.2.1.1.5.0
11:30:28.078650 IP 10.0.3.11.161 > 10.0.3.47.33748:  C="X" GetResponse(40)  .1.3.6.1.2.1.1.5.0="My-Server"
11:30:28.079206 IP 10.0.3.47.33748 > 10.0.3.11.161:  C="X" GetRequest(28)  .1.3.6.1.2.1.1.5.0
11:30:28.079396 IP 10.0.3.11.161 > 10.0.3.47.33748:  C="X" GetResponse(40)  .1.3.6.1.2.1.1.5.0="My-Server"
11:30:28.080226 IP 10.0.3.47.33748 > 10.0.3.11.161:  C="X" GetRequest(28)  .1.3.6.1.2.1.1.5.0
11:30:28.080399 IP 10.0.3.11.161 > 10.0.3.47.33748:  C="X" GetResponse(40)  .1.3.6.1.2.1.1.5.0="My-Server"
11:30:28.081053 IP 10.0.3.47.33748 > 10.0.3.11.161:  C="X" GetRequest(28)  .1.3.6.1.2.1.1.5.0
11:30:28.081218 IP 10.0.3.11.161 > 10.0.3.47.33748:  C="X" GetResponse(40)  .1.3.6.1.2.1.1.5.0="My-Server"
```

End of the Agent report:
````
[info] [snmpscan] No more SNMP device to scan
[debug] sending XML
[debug] sending: <?xml version="1.0" encoding="UTF-8"?>
<REQUEST>
  <DEVICEID>my-ocs-server-2020-10-02-11-14-34</DEVICEID>
  <QUERY>SNMP</QUERY>
</REQUEST>
````

### Inventory log file ( optional )
https://gist.github.com/groulot/00dac3fd3edb682481ae07993fe41700

**Comment by groulot** [comment]
It was a misunderstanding of the documentation. The type value I entered is wrong, it should be what the queried OID should return.

**Comment by alias59** [comment]
Hi,
I have the same error as you, can you explain to me what did you change?
